{
  "lastChanged": "Week 34",
  "banned": [
    "1357146",
    "78864369",
    "70828912",
    "4031928",
    "78706415",
    "3078576",
    "28566710",
    "57585212",
    "17375316",
    "44763025",
    "42829885",
    "12580477",
    "45986603",
    "79571449",
    "63519819",
    "72989439",
    "35316708",
    "69015963",
    "18144507",
    "34124316",
    "41482598",
    "74191942",
    "78010363",
    "85602018",
    "83764719",
    "53129443",
    "55144522",
    "34206604",
    "19613556",
    "64697231",
    "93016201"
  ],
  "limited": [
    "14878871",
    "27053506",
    "63665875",
    "2009101",
    "65192027",
    "77585513",
    "12607053",
    "40044918",
    "23205979",
    "61740673",
    "42703248",
    "97077563",
    "44656491",
    "44095762",
    "53582587",
    "82301904",
    "29401950",
    "41420027",
    "81674782",
    "57953380",
    "33508719",
    "87910978",
    "82732705",
    "85742772",
    "3136426",
    "91623717",
    "80344569",
    "37742478",
    "30241314",
    "67169062",
    "73580471",
    "9596126",
    "94192409",
    "23557835",
    "75500286",
    "44330098",
    "37520316",
    "33420078",
    "32807846",
    "27174286",
    "72892473"
  ],
  "semiLimited": [
    "9411399",
    "26202165",
    "85215458",
    "91351370"
  ]
}