{
  "lastChanged": "DM EoE",
  "banned": [
    "4031928",
    "78706415",
    "3078576",
    "28566710",
    "57585212",
    "17375316",
    "44763025",
    "42829885",
    "12580477",
    "45986603",
    "53129443",
    "79571449",
    "63519819"
  ],
  "limited": [
    "83764719",
    "55144522",
    "34124316",
    "19613556",
    "61740673",
    "77585513",
    "42703248",
    "78010363",
    "71413901",
    "97077563",
    "34206604",
    "44656491",
    "44095762",
    "74191942",
    "70828912",
    "72989439",
    "74131780",
    "85602018",
    "31560081",
    "41482598",
    "32807846",
    "23205979",
    "53582587",
    "33184167"
  ],
  "semiLimited": [
    "26202165",
    "71044499",
    "85742772"
  ]
}